{
  "schema": "https://github.com/BoBiene/ContainerRuntimeProbe/schemas/runtime-sample.v1.json",
  "schemaVersion": "1.0",
  "compactFormat": "crp1",
  "compactSample": "crp1;cls=c1,rtD,apiD,orc0,clA,pv0;conf=cH,rtM,apiH,orcU,clM,pvU;host=os:ubu24,ker:6.17.0-1011-azure,kf:Azure,arch:x64,rhos:ubu24;hw=cv:Intel,cf:IntelXeon,lc:2,vc:4,mem:16G,lim:max,flg:sha256:89abcdef;fp=sha256:89abcdef,st:RuntimeApiBacked,n:10,x:2;p=mk:S,env:S,proc:S,sbx:S,api:S,k8s:U,meta:S;sig=de,cg:docker,mt:overlay,kf:Azure,api:docker,md:az;sec=none",
  "tool": {
    "name": "ContainerRuntimeProbe",
    "version": "0.1.0-preview"
  },
  "sample": {
    "id": "crp-sample-gha-azure-docker",
    "createdAt": "2026-04-28T15:00:00Z",
    "scenarioName": "docker-azure",
    "userProvidedScenarioName": null,
    "environmentKind": "DockerLinux",
    "expectedClassification": "GitHub Actions hosted runner using Docker on Azure",
    "actualClassification": {
      "isContainerized": "True",
      "containerRuntime": "Docker",
      "runtimeApi": "DockerEngineApi",
      "orchestrator": "Unknown",
      "cloudProvider": "Azure",
      "platformVendor": "Unknown"
    },
    "confidence": {
      "isContainerized": "High",
      "containerRuntime": "Medium",
      "runtimeApi": "High",
      "orchestrator": "Unknown",
      "cloudProvider": "Medium",
      "platformVendor": "Unknown"
    },
    "host": {
      "containerImageOs": {
        "family": "Ubuntu",
        "id": "ubuntu",
        "version": "24.04",
        "prettyName": "Ubuntu 24.04.4 LTS",
        "architecture": "x64"
      },
      "visibleKernel": {
        "name": "Linux",
        "release": "6.17.0-1011-azure",
        "normalizedRelease": "6.17.0-1011-azure",
        "flavor": "Azure",
        "architecture": "x64"
      },
      "runtimeReportedHostOs": {
        "source": "DockerInfo",
        "name": "Ubuntu 24.04.4 LTS",
        "version": "24.04",
        "architecture": "x64"
      },
      "hardware": {
        "architecture": "x64",
        "cpuVendor": "Intel",
        "cpuFamily": "IntelXeon",
        "cpuModelName": "Intel(R) Xeon(R)",
        "logicalProcessorCount": 2,
        "visibleProcessorCount": 4,
        "cpuFlagsHash": "sha256:89abcdef",
        "memoryTotalBytes": 17179869184,
        "memoryTotalBucket": "16G",
        "cgroupMemoryLimitRaw": "max"
      },
      "fingerprint": {
        "algorithm": "CRP-HOST-FP-v1",
        "value": "sha256:89abcdef01234567",
        "shortValue": "sha256:89abcdef",
        "stability": "RuntimeApiBacked",
        "includedSignalCount": 10,
        "excludedSensitiveSignalCount": 2
      }
    },
    "importantSignals": [
      { "key": "marker./.dockerenv", "value": "true", "tag": "de" },
      { "key": "cgroup.pattern", "value": "docker", "tag": "cg:docker" },
      { "key": "mount.type", "value": "overlay", "tag": "mt:overlay" },
      { "key": "kernel.flavor", "value": "Azure", "tag": "kf:Azure" },
      { "key": "runtime-api.outcome", "value": "Success", "tag": "api:docker" },
      { "key": "metadata.azure", "value": "Success", "tag": "md:az" }
    ],
    "probeOutcomes": {
      "markerFiles": "S",
      "environment": "S",
      "procFiles": "S",
      "securitySandbox": "S",
      "runtimeApi": "S",
      "kubernetes": "U",
      "cloudMetadata": "S"
    },
    "securityWarnings": [],
    "redaction": {
      "mode": "safe",
      "fullReportContainsSensitiveValues": false,
      "excludedFromIssueUrl": [
        "raw mountinfo",
        "raw cgroup container ids",
        "hostname",
        "container id",
        "cloud instance id",
        "tokens",
        "secrets",
        "raw cpu serial",
        "raw full metadata documents"
      ]
    }
  }
}
